{
  "$schema": "./_table.schema.json",
  "logicalName": "cr1bd_inspectionaddress",
  "displayName": "Inspection Address",
  "displayCollectionName": "Inspection Addresses",
  "schemaName": "cr1bd_InspectionAddress",
  "description": "Per-case inspection location for the EVA record. References a Repairer (repairerId, most common) OR holds an ad-hoc location (storage yard, claimant home) OR the 'Image Based Assessment' marker. Carries the decision mode -- image_based ALWAYS requires an explicit reviewer decision + reason (never a silent pass).",
  "ownership": "UserOwned",
  "lifecycle": { "state": "staged", "note": "Defined and staged; M1 = policy gate + manual 6-line entry. Candidate ranking (M2) / EXIF+Azure Maps (M3) deferred." },
  "primaryColumn": {
    "logicalName": "cr1bd_name",
    "displayName": "Label",
    "type": "String",
    "maxLength": 200,
    "required": "required",
    "description": "Short label for the location (e.g. 'Image Based Assessment', repairer name, or 'Claimant home')."
  },
  "columns": [
    { "logicalName": "cr1bd_repairerid", "displayName": "Repairer", "type": "Lookup", "target": "cr1bd_repairer", "relationshipSchemaName": "cr1bd_repairer_inspectionaddress", "required": "none", "description": "-> Repairer (when the location IS a known repairer; don't duplicate the address). Nullable for ad-hoc / image-based." },
    { "logicalName": "cr1bd_decisionmode", "displayName": "Decision Mode", "type": "Choice", "choiceSet": "cr1bd_inspectiondecisionmode", "required": "required", "description": "confirmed_physical | manual | image_based | unknown. image_based requires a non-empty decisionReason." },
    { "logicalName": "cr1bd_decisionreason", "displayName": "Decision Reason", "type": "Memo", "maxLength": 2000, "required": "none", "description": "REQUIRED when decisionMode=image_based (override-with-reason). Recorded per the M1 policy gate; validated client + flow side." },
    { "logicalName": "cr1bd_sourcelabel", "displayName": "Source Label", "type": "String", "maxLength": 100, "required": "none", "description": "Discriminator for the catalogue row's origin. Confirmed reference rows: repairer | storage | home (the kind of ad-hoc source), all decisionMode=confirmed_physical. Low-confidence externally-sourced rows: 'suggested' (optionally 'suggested:<address_status>', e.g. 'suggested:candidate_multiple_addresses'), ALWAYS decisionMode=unknown -- never auto-confirmed. The Code App reads suggestions via startswith(cr1bd_sourcelabel,'suggested'); 16-seed-suggested-addresses.ps1 is the loader." },
    { "logicalName": "cr1bd_sourcenote", "displayName": "Source / Evidence Note", "type": "Memo", "maxLength": 2000, "required": "none", "description": "Source / evidence note backing the address decision." },
    { "logicalName": "cr1bd_addressline1", "displayName": "Address Line 1", "type": "String", "maxLength": 200, "required": "none", "description": "Ad-hoc 6-line address, line 1 (used when not referencing a Repairer)." },
    { "logicalName": "cr1bd_addressline2", "displayName": "Address Line 2", "type": "String", "maxLength": 200, "required": "none", "description": "Ad-hoc 6-line address, line 2." },
    { "logicalName": "cr1bd_addressline3", "displayName": "Address Line 3", "type": "String", "maxLength": 200, "required": "none", "description": "Ad-hoc 6-line address, line 3." },
    { "logicalName": "cr1bd_addressline4", "displayName": "Address Line 4", "type": "String", "maxLength": 200, "required": "none", "description": "Ad-hoc 6-line address, line 4." },
    { "logicalName": "cr1bd_addressline5", "displayName": "Address Line 5", "type": "String", "maxLength": 200, "required": "none", "description": "Ad-hoc 6-line address, line 5." },
    { "logicalName": "cr1bd_addressline6", "displayName": "Address Line 6", "type": "String", "maxLength": 200, "required": "none", "description": "Ad-hoc 6-line address, line 6." },
    { "logicalName": "cr1bd_postcode", "displayName": "Postcode", "type": "String", "maxLength": 16, "required": "none", "description": "UK postcode (normalised via postcode.io; AZURE_MAPS_ENABLED=false selects postcode.io in M1)." },
    { "logicalName": "cr1bd_suggestionfrequency", "displayName": "Suggestion Frequency", "type": "Integer", "required": "none", "minValue": 0, "description": "ADR-0016 offline ranking metadata: # of source EVA-export inspections deduped into this site (per provider). Suggestion-ORDERING only -- ADR-0013 unchanged (ordering, never resolution). Set on 'suggested' catalogue rows by 16-seed-suggested-addresses.ps1; NEVER carried on a Case." },
    { "logicalName": "cr1bd_lastseenon", "displayName": "Last Seen On", "type": "DateTime", "dateTimeBehavior": "DateOnly", "required": "none", "description": "ADR-0016 offline ranking metadata: most-recent Created Date among the deduped EVA-export inspections for this site. Recency input to suggestion-ORDERING only -- ADR-0013 unchanged (ordering, never resolution). Set on 'suggested' catalogue rows; NEVER carried on a Case." },
    { "logicalName": "cr1bd_suggestionrank", "displayName": "Suggestion Rank", "type": "Integer", "required": "none", "minValue": 1, "description": "ADR-0016 offline ranking metadata: 1-based rank within the provider scope, ordered by (frequency desc, lastSeen desc). The Code App ORDERS suggestions by this -- ADR-0013 unchanged (ordering, never auto-select/resolution). Set on 'suggested' catalogue rows by 16-seed-suggested-addresses.ps1; NEVER carried on a Case." }
  ],
  "alternateKeys": [
    { "schemaName": "cr1bd_inspectionaddress_label_key", "displayName": "Label Key", "columns": ["cr1bd_name"], "description": "Natural key on the deterministic label, enabling atomic PATCH-to-key upsert (Dataverse rejects upsert with 400 when no alternate key exists). Used by 16-seed-suggested-addresses.ps1 to re-run safely against the continuously-changing external suggestions source. The 12-seed confirmed-site loader keys on the same column via get-or-create, so labels remain unique across confirmed + suggested rows." }
  ],
  "notes": [
    "The serialized EVA inspection address (6 lines, padded, or 'Image Based Assessment') is written to Case.cr1bd_evainspectionaddress (EVA field 9).",
    "No path may yield 'Image Based Assessment' without decisionMode=image_based + a non-empty decisionReason.",
    "Suggested rows (sourceLabel startswith 'suggested') are catalogue-only: decisionMode=unknown, NEVER mirrored onto a Case, surfaced in the Code App strictly as low-confidence suggestions a reviewer must confirm. Loaded by 16-seed-suggested-addresses.ps1; asserted by 17-verify-suggested-addresses.ps1.",
    "ADR-0016 ranking metadata (cr1bd_suggestionfrequency, cr1bd_lastseenon, cr1bd_suggestionrank) is offline-derived from the 2-year EVA full-address export and set ONLY on 'suggested' rows by 16-seed-suggested-addresses.ps1. The Code App ORDERS suggestions by it (rank asc, else frequency desc / lastSeen desc) and surfaces a 'seen N times . last <date>' hint. This is ORDERING ONLY -- ADR-0013 is unchanged: there is no runtime resolver and nothing auto-selects; staff still pick/edit per case. The metadata is NEVER carried on a Case."
  ]
}
